{
  "displayName": "Basic App Demo",
  "description": "Basic application demo for PlutoEngine.",
  "author": "Tefek",
  "resourceRoots": {
    "icons": {
      "path": "icons",
      "type": "open"
    },
    "fonts": {
      "path": "fonts.zip",
      "type": "zip"
    },
    "plutofonts": {
      "path": "plutofonts",
      "type": "open"
    }
  }
}
